title,writtennews,autor,editor,tags,hora da publicação,hora de acesso,url
Os melhores aplicativos e jogos da semana para Android,"A Google Play recebe novos aplicativos e jogos todos os dias de desenvolvedores de diversas partes do mundo. Com tantas opções diferentes, pode ser que você encontre dificuldade em saber o que irá baixar e manter instalado no smartphone com Android. Para lhe ajudar, o Olhar Digital elaborou uma lista apenas com as principais e melhores novidades que entraram na Google Play. A seleção a seguir conta com 7 opções entre aplicativos e jogos. Confira: A lista de programas da semana traz apenas um aplicativo novo, mas conta com programas importantes e populares, que receberam atualizações importantes. Veja: O programa para controle parental do Android acaba de ganhar novas opções para que os pais controlem melhor o uso de aparelhos de seus filhos com o sistema do Google. Agora, graças a última atualização será possível definir limites de tempo por aplicativo para controlar por quanto tempo cada programa ou jogo poderá ficar em execução.  Ao utilizar o celular é bem comum que você receba notificações de diferentes aplicativos e que algumas delas não sejam lidas. Para ajudar nestes casos, o aplicativo Unnotification lhe ajuda a recuperar notificações que tenham sido dispensadas por engano.  Desenvolvido pela Xiaomi com o a Tencent, este aplicativo pode ser rodado em qualquer aparelho Android para eliminar arquivos desnecessários dos telefones liberando espaço neles. Caso queira saber mais sobre como utilizá-lo, veja este tutorial do Olhar Digital de como usar o Cleaner Lite para liberar espaço no Android.  Para a seleção de games, a nossa lista traz um jogo que retornou a Google Play e ótimas opções para quem quer algo que lhe prenda a tela do celular. Confira: Sequência do jogo indie de mesmo nome, aqui você precisa departamento de polícia para conseguir manter a ordem na cidade. Além dos combates táticos, é claro, você também precisará desvendar os mistérios de cada caso para não prender nenhum inocente.  Baseado no anime de mesmo nome, aqui você poderá encontrar os personagens mais clássicos da história do Capitão Tsubasa para levar o seu time ao estrelato.  Com gráficos da geração 8 bits, você deve ajudar um pequeno menino a se aventurar dentro de um poço a caçar diversos tesouros. A tarefa não será fácil, uma vez que estes poços estão repletos de armadilhas, que ficam mais letais a medida, que você progride. Para comemorar o retorno a Google Play deste game, ele estará de graça durante uma semana, contando a partir do dia 20 de setembro de 2019.  Um dos jogos mais populares da Google Play acaba de receber uma grande atualização para agraciar os seus fãs. Agora, os bichinhos da quinta geração e da região de Unova finalmente chegam ao jogo. Não perca tempo e vá correr atrás de capturá-los. ",Alvaro Scola,,"Aplicativos,Android,Dicas,Google Play,Jogos mobile,Dicas&Tutoriais",2019-09-20 10:52:00,2019-09-21 18:29:38.590153,https://olhardigital.com.br/dicas_e_tutoriais/noticia/os-melhores-aplicativos-e-jogos-da-semana-para-android/90540
Facebook lança Portal que permite chamadas de vídeo pela televisão,"O Facebook anunciou nessa quarta-feira (18), o lançamento do Portal TV, dispositivo conectado que permite realizar videochamadas a partir da televisão. Para utilizá-lo, basta conectá-lo a uma porta HDMI da sua televisão, acessar a conta do Facebook e fazer videochamadas por meio do Messenger e até do Whatsapp. O dispositivo, que lembra uma versão mini do Kinect, da Microsoft, é bastante intuitivo. Quando o usuário quiser fazer uma videochamada basta dizer ""Hey Portal"", para que o acessório seja ativado.  A câmera e o microfone podem ser desativados com o deslizar de uma pequena tampa localizada em frente ao dispositivo. Além disso, a ferramenta também é integrada ao Alexa, assistente virtual da Amazon. O Portal TV começa a ser vendido no dia 05 de novembro e custará US$ 149, aproximadamente 610 reais.  Via: The Verge  ",Matheus Luque,,"Microsoft,Amazon,Facebook,Kinect,Whatsapp,facebook messenger",2019-09-18 16:09:00,2019-09-21 18:29:39.363904,https://olhardigital.com.br/games-e-consoles/noticia/facebook-lanca-portal-que-permite-chamadas-de-video-pela-televisao/90460
Instagram vai apagar contas de usuários com menos de 13 anos,"O Instagram começou a seguir com mais rigor seus termos de uso. O funkeiro mirim Nego Ney foi comunicado que sua conta seria deletada e ""sem chances de ser mantida, ainda que um adulto tenha dado permissão para se inscrever na rede social"" por conta de sua idade. Além do xodó do Flamengo, as contas dos filhos de Karina Bacchi e Mayra Cardi, ambos com menos de 3 anos, e de todos que utilizam a plataforma e não possuem a idade adequada, serão apagadas.  Os termos de uso da rede social indicam que a idade mínima para ter acesso ao seu serviço é de 13 anos. Ainda assim, o garoto de apenas 8 anos criou a conta no dia 17 de março, mas, somente agora, o Instagram decidiu agir e notificá-lo da impossibilidade de seguir usando os serviços da rede social. As contas de Enrico Bacchi e Sophia Cardi, que possuem 2,3 milhões e 652 mil seguidores, respectivamente, e são administrados pelas mães das crianças, também foram apagadas. Procurado pelo Olhar Digital, o Instagram comunicou que seus termos de uso sempre foram claros e qualquer conta utilizada por menores da idade estabelecida será removida.  ""Queremos que nosso Serviço seja o mais aberto e inclusivo possível, mas também desejamos que ele seja seguro e esteja em conformidade com a lei. Por isso, precisamos que você se comprometa em relação a algumas restrições para fazer parte da comunidade do Instagram"".    Fonte: Uol   ",Fabrício Filho,Matheus Luque,"plataforma de serviços,termos de uso,rede social,instagram,e-mail",2019-09-18 17:09:00,2019-09-21 18:29:39.384800,https://olhardigital.com.br/noticia/instagram-vai-apagar-contas-de-usuarios-com-menos-de-13-anos/90464
"Apple diz que multa de US$ 14 bilhões ""desafia o bom senso""","A Apple já está no segundo mais alto tribunal da Europa apelando contra o pagamento de US$ 14 bilhões em impostos atrasados na Irlanda. Neste caso de 2016, a Comissão Europeia alega que a empresa se beneficiou de auxílios fiscais ilegais para duas filiais irlandesas durante duas décadas. Na úlitma terça-feira (17), o vice-presidente financeiro da Apple, Luca Maestri, levou uma delegação de seis membros ao Tribunal Geral, onde cinco juízes ouviram seus argumentos durante dois dias. ""A Comissão alega que essencialmente todos os lucros da Apple com todas as suas vendas fora das Américas devem ser atribuídos a duas filiais na Irlanda"", afirmou o advogado da Apple, Daniel Beard, ao tribunal. Beard disse que o iPhone, o iPad, a App Store e seus principais direitos de propriedade intelectual foram desenvolvidos nos Estados Unidos, e não na Irlanda. ""As atividades das filiais não envolveram a criação, desenvolvimento ou gerenciamento desses direitos. Com base nos fatos deste caso, a linha principal desafia a realidade e o bom senso"", continuou Beard. A União Europeia também é acusada pela Irlanda de tentar combater os auxílios estatais e interferir em leis nacionais, tentando efetivamente mudar o sistema tributário internacional e criar incerteza jurídica para as empresas. Com taxa tributária global média de 26%, a Apple diz ser a maior contribuinte do mundo – agora mesmo, a gigante alega estar pagando cerca de 20 bilhões de euros em impostos nos EUA referentes aos lucros que, segundo a UE, deveriam ter sido tributados na Irlanda. Para o advogado irlândes, Paul Gallagher, as críticas ao país são totalmente injustificadas e a confusão se deve a uma incompatibilidade com o sistema tributário norte-americano. ""A decisão da Comissão é fundamentalmente falha"", disse ao tribunal. Espera-se que uma decisão seja tomada nos próximos meses. A parte derrotada ainda poderá recorrer ao Tribunal de Justiça da UE e um julgamento final pode levar vários anos. Fonte: Reuters",Henrique  Freitas,Matheus Luque,"Apple,Europa,união europeia,multa,Irlanda,pagamento,auxílio fiscal,sistema tributário",2019-09-18 16:09:00,2019-09-21 18:29:39.428029,https://olhardigital.com.br/noticia/apple-diz-que-multa-de-us-14-bilhoes-desafia-o-bom-senso/90463
Nova linha de produtos da Huawei vaza antes do evento,"A Huawei realizará amanhã (19) um evento em Berlim para apresentar vários novos produtos, mas não precisamos esperar até lá para conhecê-los. Todos os produtos que serão anunciados vazaram, cortesia do site Android Headlines, um dia antes do lançamento. A estrela do evento serão, sem dúvida, os novos smartphones da família Mate, o Mate 30 e Mate 30 Pro. Este terá um novo tipo de tela, apelidado de “cascata”, que se curva e cobre as laterais do smartphone, resultando em bordas muito finas. Com tecnologia OLED, ela tem 6,7” e um notch considerável no topo, que abriga um conjunto de sensores para um novo sistema de reconhecimento facial desenvolvido pela Huawei. O aparelho terá sete câmeras: quatro atrás, arranjadas dentro de um círculo (que lembra o Nokia Lumia 920), e três na frente. Duas das câmeras traseiras (wide e ultrawide) terão sensores de 40 MP. Uma terceira (com zoom óptico de 3x) tem sensor de 8 MP e a quarta câmera é um sensor ToF para detecção de profundidade. O Mate 30 Pro será compatível com 5G e baseado no processador Kirin 990, que tem um modem 5G integrado. Quanto à memória, haverá versões com 6 GB de RAM e 128 GB de memória interna e 8 GB de RAM e 256 ou 512 GB de memória interna. A Huawei também irá apostar nos smartwatches. Serão apresentados 4 modelos do Huawei Watch GT2, dois com caixa de 42 mm e tela AMOLED circular de 1.2 polegadas e dois com caixa de 46 mm (como o modelo atual), com tela AMOLED também circular de 1,39 polegadas. De acordo com os rumores, o modelo menor (42 mm) não tem microfone, o que indica que também não tem suporte a LTE para conexões de dados ou chamadas telefônicas. Ambos os modelos serão baseados em um processador da própria Huawei, o A1. Os relógios tem certificação de resistência a àgua a uma profundidade de até 50 metros. Assim como no Watch GT original, os novos smart watches devem rodar um sistema operacional próprio, e não o Wear OS da Google.  A empresa também tem uma pulseira fitness, que por enquanto é conhecida apenas pelo codinome Andes. Com uma face retangular e tela OLED colorida, ela lembra a Mi Band 4 da Xiaomi. Na traseira, o acessório também tem um sensor de batimentos cardíacos e um oxímetro, capaz de medir o consumo de oxigênio e, com isso, a queima de calorias. Além destes produtos, a empresa também deve lançar uma TV com o sistema operacional Harmony OS e um tablet, que pode ser uma versão global do MediaPad M6, que já foi apresentado na China em Junho.  A grande curiosidade é sobre como alguns dos novos produtos (Mate 30 e 30 Pro, MediaPad) serão afetados pelas sanções impostas pelo governo americano, que restringem o acesso da Huawei ao sistema operacional Android e serviços do Google. Fonte: Android Headlines",Rafael Rigues,,"Smart TV,Huawei,Smartwatch,smartphone,wearable,Mi Band,Mate 30 Pro",2019-09-18 15:39:00,2019-09-21 18:29:39.581335,https://olhardigital.com.br/noticia/nova-linha-de-produtos-da-huawei-vaza-antes-do-evento/90458
"Apple finalmente coloca bateria grande, de 4.000 mAh, em um iPhone","O iPhone 11 pode não trazer muita diferença em relação ao modelo do ano anterior por fora, mas ele marca uma mudança importante na estratégia da Apple. A empresa finalmente decidiu colocar uma bateria de respeito dentro dos seus dispositivos, chegando a quase 4.000 mAh no modelo Pro Max. A Apple não fala abertamente sobre quantidade de bateria ou de memória RAM que inclui em seus iPhones, o que significa que a única forma de descobrir isso é por meio da desmontagem dos aparelhos ou pelos documentos de homologação com agências reguladoras. Este último caso foi o que aconteceu na China, onde a TEENA (órgão equivalente a Anatel no país) revelou as informações pendentes sobre o aparelho, como notou o site MacRumors. Os documentos mostram as seguintes especificações: Em relação à bateria, os maiores ganhos estão nos aparelhos “Pro”, principalmente o Max, que ganhou quase 1.000 mAh a mais em relação ao seu predecessor, o iPhone XS Max. Veja como eram as especificações dos modelos de 2018: Quando apresentou seus novos celulares, a Apple havia se limitado a falar em horas extras de uso, o que não diz muita coisa, já que os ganhos poderiam ser atribuídos a melhorias no processador em termos de eficiência, por exemplo, que já foi um argumento apresentado pela companhia no passado enquanto a capacidade da bateria diminuía. No momento do anúncio, a empresa apontava que o iPhone 11 conseguia até uma hora a mais de uso do que o XR, enquanto o os modelos Pro conseguiam até cinco horas a mais de uso do que os aparelhos XS. Agora sabemos de onde vem essa autonomia ampliada. A ampliação da bateria mostra uma mudança de visão da Apple sobre o iPhone. Por anos, a empresa ficou marcada por valorizar forma sobre função, o que fazia com que seus celulares ficassem mais finos às custas de uma bateria menor. Nos últimos anos, a empresa começou a fazer seus iPhones mais grossos, mas a bateria ainda não havia acompanhado a tendência.",Renato  Santino,,"iPhone,Apple,Bateria,iphone 11",2019-09-18 15:00:00,2019-09-21 18:29:39.669630,https://olhardigital.com.br/noticia/apple-finalmente-coloca-bateria-grande-de-4-000-mah-em-um-iphone/90457
Redes sociais podem afetar o bem-estar e a saúde mental,"Parece um ambiente seguro. Afinal, fica dentro de casa, onde pais e familiares podem se manter alertas sobre qualquer movimentação. Só que muitas vezes é um vale sombrio repleto de solidão. Uma solidão acompanhada de muito ciberbullying. Este é o cenário da internet hoje para muitos. Em julho, houve um caso muito simbólico: a blogueira Alinne Araújo, que falava justamente sobre sua própria depressão nas redes, cometeu suicídio um dia após casar-se consigo mesma — ela decidiu seguir com o casamento mesmo depois da desistência do noivo, um dia antes da cerimônia. Todos achavam que ela estava bem: os mais próximos interpretaram a atitude como um sinal de que ela havia superado a situação, mas os seguidores não perdoaram e o ciberbullying deu o tom no perfil de Alinne durante horas. Muitos diziam que a blogueira estava agindo daquela forma (casando-se consigo mesma) apenas para chamar a atenção. Ela, então, sucumbiu. Crianças, adolescentes ou adultos, ninguém está livre de ter sua saúde mental abalada. Nas redes sociais, isso pode ser ainda mais perigoso: o contato com os haters pode levar ao sofrimento psicológico. Um estudo da Royal Society for Public Health, conduzido em 2017, aponta o Instagram como a pior plataforma para a saúde mental dos usuários — recentemente, a rede foi a primeira a ocultar as curtidas nas publicações, como forma de preservar os usuários. Outras pesquisas sobre a relação entre as redes sociais e diferentes desordens mentais (principalmente depressão e ansiedade) têm sido cada vez mais frequentes. Os resultados apontam para o alto risco de incidência de distúrbios em associação com o uso dessas plataformas. Outros dados parecem confirmar: a quantidade de crianças de 10 a 14 anos que morreram por suicídio aumentou 65% entre 2000 e 2015, segundo um estudo da Faculdade Latino-Americana de Ciências Sociais (Flacso Brasil) com base em dados do Ministério da Saúde. Entre adolescentes de 15 a 19 anos, o crescimento foi de 45% no mesmo período. Como esses casos são, em geral, subnotificados, os números podem ser, infelizmente, ainda maiores. Contato humano Todo ser humano busca ser aceito. É fácil ver isso nas redes sociais: as fotos são sempre maravilhosas, de refeições a viagens, passando por roupas, sapatos e piscinas. Com isso, a impressão que se tem é de que a vida alheia é sempre melhor que a própria — um desencadeante perigoso de sentimento de inferioridade e outros males. Se a isso for acrescentada a rejeição, especialmente em um ambiente tóxico (as redes sociais muitas vezes têm esse viés, especialmente em comentários maldosos e pouco gentis), o indivíduo pode desenvolver baixa autoestima e passar a sofrer em silêncio. Esses contatos nocivos online, então, minam sua autoconfiança e o fazem se retrair e se isolar cada vez mais. É um ciclo vicioso, especialmente porque uma das características da geração atual é o uso constante de gadgets. Muitos jovens não têm nem a habilidade de falar com pessoas, pois só se relacionam com eletrônicos. “Viver apenas o mundo digital é problemático. O indivíduo deixa de ter contatos reais: não conversa com amigos pessoalmente, não joga bola, não faz atividades em que há proximidade humana”, explica a psicóloga Priscila Gasparini Fernandes. Ela conta o caso de uma criança que ficou impressionada ao ver uma galinha em um passeio de férias. Isso porque só tinha visto aquele animal de forma virtual e, ao se deparar com ele em um ambiente real, veio o choque. Fica claro, então, que os contatos reais estão em falta — o que pode ser problemático em diversas situações. Segundo Priscila, o isolamento voluntário deprime o indivíduo e pode levá-lo a ter uma fobia social. “Antes, a depressão era associada ao quarto escuro, em que o paciente se trancava. Hoje, o doente busca a internet para evitar contatos reais”, destaca. “Ali, ele se sente mais confortável e, como não há censura, pode chegar a espaços pouco saudáveis e encontrar incentivo para o suicídio. Por isso, é importante que amigos e familiares estejam atentos.” A psicóloga faz um alerta: é importante que as pessoas se interessem umas pelas outras. Em casa, por exemplo, o diálogo deve ser prioridade. É fundamental que os pais saibam por onde seus filhos andam online. “A conversa é o mais importante. Impor limites e regras é parte do processo, mas conhecer o filho é essencial.” Só assim, ela pontua, os pais vão saber se seus filhos são tímidos ou se estão sofrendo. Campanhas de prevenção A importância da prevenção é cada vez mais clara e a informação é essencial nesse contexto. Neste setembro (amarelo), duas iniciativas do Instituto Vita Alere, com apoio da SaferNet Brasil, do Google e da Unicef, pretendem servir de auxílio para pais, mães, educadores e adolescentes: a ideia é falar abertamente sobre sofrimento mental, suicídio e uso seguro e responsável da internet. Intitulada #éprecisofalar, a campanha tem cartilhas informativas sobre esses temas. Os materiais, disponíveis para download gratuito, têm dicas sobre fatores de risco, prevenção e formas de denunciar conteúdos impróprios nas redes sociais. Em 2018, o Vita Alere fez a campanha #euestou, sobre prevenção de suicídio para jovens, que alcançou 15 milhões de pessoas. Agora, mais uma série de vídeos do instituto aborda o assunto. O YouTube, por sua vez, criou uma websérie para discutir bem-estar e saúde mental no contexto da internet. Composta por seis episódios, chama-se “Depressão não é frescura” e busca, em linguagem simples, informar e conscientizar sobre as causas e os efeitos da depressão a partir de um melhor entendimento sobre a doença. Dieta digital Todos devem se policiar a respeito do uso excessivo das redes sociais. Uma das opções para avaliar a qualidade do relacionamento com a tecnologia — e, mais notadamente, com essas plataformas — é calcular o Índice de Massa Virtual. O conceito, criado pelo jornalista canadense Daniel Sieberg, autor de “Dieta Digital”, pode ajudar a descobrir quando se está passando dos limites. Para saber o seu, responda às perguntas a seguir e multiplique a quantidade pelo valor indicado em cada item. Agora, some todos os resultados e compare com as opções a seguir: 24 pontos ou menos Você está dentro da média considerada adequada. O uso que você faz da internet e das redes sociais é saudável. De 25 a 35 pontos Fique atento! Ser mais comedido no uso das ferramentas virtuais pode ajudá-lo a viver melhor. 36 pontos ou mais Você precisa de uma dieta virtual. Controlar o uso da internet e das redes sociais vai lhe trazer benefícios.",Roseli Andrion,,"Internet,Youtube,redes sociais,Tecnologia,depressão,saúde mental,ansiedade",2019-09-20 19:51:00,2019-09-21 18:29:39.751386,https://olhardigital.com.br/noticia/redes-sociais-podem-afetar-o-bem-estar-e-a-saude-mental/90584
Empresa lança bicicleta elétrica que chega a 32 km/h,"A empresa californiana Karmic lança modelo de bicicleta elétrica que chega a atingir velocidade superior a 30 km/h. Trata-se do ""Oslo"", a nova bicicleta de Classe 2 da empresa.  O novo modelo, mesmo que não aparente à primeira vista, possui pedais. A bicicleta tem uma estrutura compacta, com um acelerador que pode ser acionado mesmo no topo de sua velocidade máxima concedida por pedal, de 32 km/h. Com uma estrutura feita de alumínio e carroçaria termoplástica, o veículo completo pesa 20 kg, considerado mais leve que a maioria das bicicletas elétricas, mas também menos potente. ""Esperamos que a maioria das pessoas use o acelerador"", disse Hong Quan, CEO da Karmic, em uma postagem no Twitter. A Karmic também oferece uma bateria opcional de 960Wh de alcance estendido em desenvolvimento, segundo Quan.   O visual foi projetado para ser mais limpo e acessível do que a maioria das bicicletas eletrônicas, o que fez com que algumas pessoas afirmassem que o Oslo é o resultado de como seria se a Apple projetasse e-bikes, devido à sua simplicidade e estilo. ""Embora tenha havido grandes avanços na tecnologia de veículos elétricos, as bicicletas eletrônicas permaneceram praticamente as mesmas"", diz a empresa em seu comunicado à imprensa. “Apesar de tudo, acreditávamos que a melhor bicicleta elétrica ainda não havia sido construída. Então nós a construímos"", afirmou a Karmic.  A Karmic pretende arrecadar US$ 200 mil para a produção do veículo e, caso a arrecadação ocorra rapidamente, lançá-lo ano que vem. A empresa oferecerá garantia de dois anos.      Via: The Verge ",Fabrício Filho,Matheus Luque,"Design,Velocidade,Mobilidade,mobilidade urbana,bicicleta,Bicicleta elétrica",2019-09-18 15:09:00,2019-09-21 18:29:39.806236,https://olhardigital.com.br/noticia/empresa-lanca-bicicleta-eletrica-que-chega-a-32-km-h/90459
Nova Zelândia será novamente a Terra Média na série O Senhor dos Anéis,"A Amazon Studios confirmou que a Nova Zelândia voltará a ser o lar dos hobbits na nova série “O Senhor dos Anéis”, estimada como uma das produções televisivas mais caras de todos os tempos. A companhia comprou os direitos de televisão da trilogia de J.R.R. Tolkien há dois anos. Segundo o estúdio da Amazon.com, a adaptação vai explorar histórias que antecedem o primeiro livro da saga, “A Sociedade do Anel”. “Enquanto procurávamos a locação na qual poderíamos dar vida à beleza primordial da segunda era da Terra Média, sabíamos que precisávamos encontrar um lugar majestoso, com litorais, florestas e montanhas imaculadas e que também abrigasse sets de primeira linha, estúdios, artesãos e outros profissionais habilidosos e experientes”, disseram os produtores-executivos J.D. Payne e Patrick McKay em um comunicado. A pré-produção da série já começou, e a produção terá início nos próximos meses na maior cidade neo-zelandesa, Auckland. Espera-se que a nova série fortaleça a economia local e gere muitos empregos. “Esta é uma produção cobiçada e uma notícia fantástica para o setor cinematográfico da Nova Zelândia e para a nossa economia”, disse em comunicado o ministro de Desenvolvimento Econômico do país, Phil Twyford . Os três filmes da saga “O Senhor dos Anéis” foram feitos no início dos anos 2000, filmados na Nova Zelândia e dirigidos por Peter Jackson. Os longas lucraram quase 3 bilhões de dólares e ganharam 17 Oscars. A Amazon Game Studios também está desenvolvendo um jogo MMO (Massively Multiplayer Online Game) em parceria com Athlon Games (uma divisão da Leyou) de ""O Senhor dos Anéis"". O game será para PC e consoles e se passa “muito antes dos eventos de O Senhor dos Anéis, explorando terras, pessoas e criaturas jamais vistas pelos fãs do universo Tolkien”, de acordo com comunicado à imprensa. Fonte: Reuters",Luiza Tozzato,Liliane Nakagawa,"Televisão,Amazon,TV,séries,Filmes&Series,Livro,Senhor dos Anéis",2019-09-18 14:22:00,2019-09-21 18:29:39.834703,https://olhardigital.com.br/cinema-e-streaming/noticia/nova-zelandia-sera-novamente-a-terra-media-na-serie-o-senhor-dos-aneis/90456
