title,writtennews,autor,editor,tags,hora da publicação,hora de acesso,url
Facebook anuncia três novos dispositivos da linha Portal,"No ano passado, o Facebook lançou um dispositivo chamado Portal, um aparelho que permitia aos usuários realizar chamadas de vídeo. Com os constantes questionamentos sobre privacidade da empresa, alguns usuários não se sentiram confiantes em levar para sua casa um dispositivo que possui uma câmera e um microfone e que tinha ligação direta com a empresa de Mark Zuckerberg.   Entretanto, o Facebook provou que não desistiu da ideia do Portal, e planeja lançar três novos produtos da mesma marca: Portal Mini, Portal TV e um novo Portal. A ideia de lançar esses novos dispositivos pode parecer estranha para muitos, mas, segundo um porta-voz da empresa, ""ficamos felizes com as vendas, e por isso é que estamos expandindo a família de produtos"". Os novos dispositivos foram reformulados para apresentarem um design mais discreto. O novo modelo e o Portal Mini foram modificados para ficarem parecidos com um porta-retratos. O novo dispositivo possui uma tela HD de 10 polegadas, enquanto sua versão Mini possui uma tela menor, de 8 polegadas.  O Portal TV, por sua vez, se assemelha a uma webcam e foi projetado para funcionar conectado à televisão do usuário por meio de conexão HDMI. Alguns rumores indicavam que o Facebook estava trabalhando em um dispositivo da família Portal que possui alguns recursos voltados para a Realidade Aumentada, o Portal TV provavelmente é esse aparelho. Além da conexão com o Messenger para realizar as chamadas de vídeo, os usuários podem se conectar ao WhatsApp para conversar com seus contatos. Além disso, será possível assistir a vídeos usando o dispositivo, isso porque ele possui o aplicativo Amazon Prime Video e alguns outros apps de streaming de vídeo podem ser baixados. A empresa parece querer tranquilizar todos os usuários de que seus novos dispositivos são seguros. De acordo com a companhia, todos os aparelhos da linha Portal possuem a opção de desativar a câmera e o microfone ao toque de um botão. Há também uma tampa para que o usuário cubra a lente da câmera manualmente. Também ficou claro que os recursos de câmera inteligente e Smart Sound, que captam sons e imagens do ambiente para melhorar a experiência dos usuários, farão o processamento das imagens localmente, e não nos servidores do Facebook. Mesmo assim, a empresa de Zuckerberg destaca que, ao utilizar o comando ""Hey Portal"", os dispositivos enviam pequenas gravações e transcrições de áudio para o Facebook. De acordo com eles, essa prática será utilizada para ""tornar seus serviços de voz mais inteligentes e precisos para todos"". Os usuários também poderão visualizar, ouvir e excluir qualquer gravação de voz que o dispositivo fizer por meio do registro de atividades do Facebook, além de ter a opção de desativar o armazenamento de voz. As pré-vendas dos aparelhos começaram na última quarta-feira (18) nos EUA. O Portal Mini vai custar US$ 130 (aproximadamente R$ 540) e o Portal padrão será vendido por US$ 180 (aproximadamente R$ 750). O Portal TV chega custando US$ 150 (aproximadamente R$ 620). O Portal e sua versão Mini serão lançados no dia 15 de outubro, o Portal TV chega um pouco mais tarde, em 5 de novembro. Via: Gizmodo",Luiz Nogueira,Matheus Luque,"Facebook,Tecnologia,Whatsapp,facebook messenger,Portal,portal tv",2019-09-20 09:09:00,2019-09-21 18:29:42.241093,https://olhardigital.com.br/noticia/facebook-anuncia-tres-novos-dispositivos-da-linha-portal/90537
"Google Maps, Waze e Pandora funcionam com assistente Siri no iOS 13","O iOS 13 foi lançado na última quinta-feira (19) e trouxe mudanças muito aguardadas pelos usuários, como modo noturno e atualização no aplicativo Mapas da Apple. Porém, uma das maiores mudanças certamente veio da Siri, que ganhou função capaz de abrir apps de terceiros.  Anteriormente, os usuários poderiam pedir por formulações de rotas para Siri, mas ela sempre abriria o Mapas da Apple. Agora, porém, é possível especificar quando você desejar abrir aplicativos de terceiros, por exemplo o Waze ou o Google Maps. O The Verge testou o recurso do iOS 13, porém disse que algumas configurações ainda estão falhas. Embora tenha sido possível abrir alguns endereços no Google Maps, sempre que o destino era mais detalhado e incluía o número do local, a Siri abria automaticamente o Mapas da Apple. Em contraponto, pedidos para a Siri tocar música em aplicativos de terceiros funcionou perfeitamente, segundo The Verge. O repórter disse para a assistente tocar artistas diferentes no Pandora e sempre funcionou. Alguns usuários do Reddit disseram que uma versão beta do Spotify permite que a Siri abra o aplicativo e responda aos comandos. Também espera-se que seja possível pedir que a assistente reproduza podcasts e audiolivros. Vale lembrar que por padrão a Siri continua direcionando o usuário a aplicativos da Apple. Portanto, se quiser abrir o Waze, por exemplo, terá que dizer especificamente o nome do app no final. O pedido ficaria algo como: ""toque Frank Ocean em Pandora"" ou ""mostre as direções para São Paulo no Google Maps"". Via: The Verge",Clara Guimarães,Matheus Luque,"iPhone,Apple,Google Maps,iOS,Spotify,Siri,waze,smartphone,comando por voz,apple maps,assistente pessoal,iOS 13,Celular,deezer",2019-09-20 09:09:00,2019-09-21 18:29:42.265717,https://olhardigital.com.br/noticia/google-maps-waze-e-pandora-funcionam-com-assistente-siri-no-ios-13/90536
Funcionário do Facebook comete 'suposto suicídio' em sede da empresa,"O Departamento de Polícia de Menlo Park disse na quinta-feira (19) que respondeu a um ""suposto suicídio"" na sede do Facebook. Um homem, que mais tarde foi confirmado como funcionário da empresa, se matou pulando do quarto andar de um prédio do campus. ""O Serviço de Medicina Legal do Condado de San Mateo respondeu e transportou a vítima para o Hospital do Condado de San Mateo. A identidade da vítima está sendo retida, aguardando notificação do parente mais próximo"", diz relatório oficial da polícia. Um porta-voz do Facebook disse todos ficaram tristes em saber da notícia e que a empresa está colaborando com a polícia e prestando apoio aos funcionários. ""Enquanto a família está sendo notificada, não temos informações para compartilhar. Esperamos fornecer uma atualização quando soubermos informações adicionais da polícia"". Via: CNBC   ",Clara Guimarães,Matheus Luque,"redes sociais,Facebook,Mídias sociais,polícia,Morte",2019-09-20 08:09:00,2019-09-21 18:29:42.541219,https://olhardigital.com.br/noticia/funcionario-do-facebook-comete-suposto-suicidio-em-sede-da-empresa/90533
CEO da Huawei diz que Mate 30 poderia receber Google Apps em uma noite,"Durante entrevista após o lançamento dos smartphones Mate 30 e Mate 30 Pro o CEO da Huawei, Richard Yu, afirmou que a empresa seria capaz de entregar uma atualização para os novos aparelhos com as Google Apps “em uma noite”. A declaração foi uma resposta a um jornalista, que perguntou se a empresa planejava adicionar estes serviços aos aparelhos caso as sanções dos EUA contra a empresa fossem removidas. Devido às sanções, os novos aparelhos não contém nenhum app ou serviço do Google, como Maps, YouTube, Chrome ou PlayStore. Eles ainda rodam o Android 10, baseado no código Open Source distribuído pelo projeto AOSP, com a EMUI da própria Huawei. Para tentar contornar a proibição, a empresa quer incentivar desenvolvedores dos EUA a criarem apps para a plataforma. Richard Yu, CEO da companhia, diz que o Programa de Incentivo ao Ecossistema HMS (Huawei Mobile Services), que terá investimento de US$ 1 bilhão, busca estimular desenvolvedores a criarem aplicativos e comercializá-los em telefones da Huawei fora da China. Esses profissionais terão participação de 85% na receita dos apps — enquanto o Google e a Apple oferecem 70%. Lançados na última quinta-feira (19), o Mate 30 e Mate 30 Pro são os novos carros-chefe da Huawei. O modelo mais sofisticado, Mate 30 Pro, é equipado com o novo processador Kirin 990, desenvolvido pela própria Huawei, com modem 5G integrado e um sistema de sete câmeras, quatro na traseira e três na frente, sobre a tela. Fonte: Android Authority",Rafael Rigues,,"Google,Android,open source,Huawei,smartphone,play store,eua x china,app",2019-09-20 09:09:00,2019-09-21 18:29:42.590717,https://olhardigital.com.br/noticia/ceo-da-huawei-diz-que-mate-30-poderia-receber-google-apps-em-uma-noite/90534
Apple é acusada de piratear músicas de artistas renomados,"Um novo processo alega que a Apple pirateou músicas de grandes cantores do passado no seu serviço de streaming. Alguns nomes citados incluem Frank Sinatra, Billie Holliday, Charlie Parker, Dean Martin, Duke Ellington, Ella Fitzgerald e Ray Charles. Segundo acusação, a Apple concordou com termos de licenciamento das empresas Orchard e Cleopatra, sendo que nenhuma delas tem posse dos direitos autorais das gravações citadas. ""A Apple teve conhecimento de sua própria conduta infratora e a de Cleopatra e Orchard por vários anos e continuou trabalhando com eles e fazendo entregas digitais de registros fonográficos e outras reproduções e distribuições das gravações pirateadas que Cleopatra e Orchard fornecem e/ ou eram imprudentemente indiferentes ou deliberadamente cegos à sua própria conduta infratora"", diz o processo. O trecho sugere que a Apple tinha recursos suficientes para identificar que as gravações licenciadas não pertenciam às empresas Cleopatra e Orchard, mas não fez a devida checagem, seja por ingenuidade ou para ganho próprio.  Esta não é a primeira vez que a Apple passa por acusações de pirataria. Em maio deste ano, a empresa respondia por um processo de 148 páginas sobre ""pirataria maciça de música"". Via: 9to5Mac",Clara Guimarães,Rafael Rigues,"Música,Apple,Streaming,Pirataria,identificador de músicas,Apple music,licenciamento,Lei,Processos",2019-09-20 08:09:00,2019-09-21 18:29:42.851607,https://olhardigital.com.br/noticia/apple-e-acusada-de-piratear-musicas-de-artistas-renomados/90529
Desmonte do iPhone 11 Pro Max confirma bateria 25% maior,"O primeiro vídeo com o desmonte (teardown) de um iPhone 11 Pro Max, feito pelo canal vietnamita DChannel no YouTube, revela o segredo por trás da maior autonomia de bateria do dispositivo, que é de até 5 horas a mais que o iPhone XS. O motivo principal é uma bateria maior. O modelo usado no iPhone 11 Pro Max tem capacidade de 15.04 Watts/hora, quase 25% a mais que os 12.06 Watts/hora no iPhone XS Max. A construção da bateria também mudou: ambas tem um formato de “L”, para aproveitar melhor o espaço interno no aparelho, mas a usada no iPhone XS Max é composta por duas células interconectadas, enquanto a do iPhone 11 Pro Max é uma peça única.  Além do tamanho da bateria, otimizações no consumo de energia pelo processador A13 Bionic também ajudam na autonomia. São elas, por exemplo, responsáveis pela hora extra de autonomia do iPhone 11 sobre o iPhone XR, embora ambos usem baterias com quase a mesma capacidade. Fonte: The Verge",Rafael Rigues,,"iPhone,Bateria,smartphone,iPhone XS Max,iphone 11",2019-09-20 08:09:00,2019-09-21 18:29:42.878140,https://olhardigital.com.br/noticia/desmonte-do-iphone-11-pro-max-confirma-bateria-25-maior/90531
Twitter lança recurso de ocultar respostas a um tuíte nos EUA e Japão,"O controverso recurso de esconder respostas específicas a tuítes está disponível para os usuários do Twitter nos EUA e do Japão. A adição é uma das mudanças mais radicais no Twitter até o momento. Isso coloca as pessoas no controle de uma conversa que elas começaram, dando-lhes a capacidade de ocultar as contribuições que atrapalhem a conversa. Essas respostas, que podem variar de irrelevantes a ofensivas, não são excluídas da rede social, elas são ocultadas e podem ser acessadas a qualquer momento. Com isso, o alcance de mensagens escritas por pessoas que fazem comentários inapropriados ou intimidadores será diminuído, fazendo com que suas mensagens não sejam lidas pela maioria dos participantes da discussão. Anteriormente, as únicas opções oferecidas pelo Twitter para lidar com esse tipo de comentário era a de 'silenciar', 'bloquear' e 'denunciar'. 'Bloquear' e 'silenciar', no entanto, afetava apenas a pessoa que fez essas ações. O agressor não verá mais aquela postagem, mas os outros continuam. 'Denunciar' um tuíte também é um processo limitado e que leva tempo, além do fato de que a rede social remove apenas as mensagens que violam alguma de seus diretrizes de utilização. Definitivamente não é uma solução imediata para uma conversa que rapidamente saiu do controle. Embora a opção de ""ocultar respostas"" ajude a resolver esses problemas, ela também traz desafios próprios. Poderia ser usada como uma maneira de silenciar opiniões divergentes, incluindo esclarecimentos de empresas sobre determinado assunto. Desde os testes realizados anteriormente, o Twitter informou que as pessoas usavam o recurso principalmente para ocultar respostas que consideravam irrelevantes, abusivas ou difíceis de entender. O feedback dos usuários também foi positivo, pois aqueles que usaram a ferramenta disseram que acharam uma maneira útil de controlar o que viam - semelhante ao silenciamento de palavras-chave. Ao silenciar uma resposta, a plataforma vai perguntar se os usuários desejam também bloquear a conta responsável pela mensagem. Isso esclarece que a opção de ""ocultar"" é uma função diferente do bloqueio de usuários. Apesar da expansão, o Twitter informa que a opção ""Ocultar respostas"" ainda é considerada um teste, pois a empresa continua avaliando o sistema e a função ainda não está disponível para a base global de usuários do Twitter. Via: TechCrunch      ",Luiz Nogueira,Rafael Rigues,"Aplicativos,Twitter,rede social,atualização,EUA,Japão",2019-09-20 08:09:00,2019-09-21 18:29:42.899339,https://olhardigital.com.br/noticia/twitter-lanca-recurso-de-ocultar-respostas-a-um-tuite-nos-eua-e-japao/90530
Série sobre Bill Gates estreia hoje na Netflix,"Bill Gates é um dos grandes nomes da indústria da tecnologia. E ele acaba de ganhar uma série documental: ""O Código Bill Gates"" (""Inside Bill's Brain: Decoding Bill Gates"", em inglês) já está disponível na Netflix. A série foi dirigida por Davis Guggenheim (diretor de ""Uma Verdade Inconveniente""), ganhador do Oscar de 2007, e tem três episódios de pouco mais de 50 minutos cada. Ela mostra a infância, a carreira e a trajetória do visionário, além de trazer detalhes sobre sua vida pessoal, sua rotina e seus hábitos. A obra passa por toda a vida de Gates: da fundação da Microsoft ao auge da companhia, nos anos 1990, momento em que a empresa passou a ser visada pela justiça dos EUA por práticas monopolistas. A incessante rotina de trabalho, os desafios e o caminho percorrido até se tornar um dos homens mais ricos do mundo estão presentes no documentário. A série fala, ainda, sobre a relação de Gates com Paul Allen, cofundador da Microsoft, falecido no ano passado. Além disso, o documentário promete mostrar as iniciativas do magnata após deixar a liderança da empresa: entre elas, os planos para auxiliar no combate a doenças em países de economia subdesenvolvida e tentar evitar o aquecimento global. Como o próprio título indica, a obra aborda o funcionamento do cérebro de Gates. Em determinado momento, o executivo é perguntado sobre seu maior medo. A resposta é imediata: ""não quero que meu cérebro pare de funcionar"". Davis Guggenheim, diretor da série, afirma que o documentário mostra Gates trabalhando em problemas que ainda não conseguiu resolver. Segundo o fundador da Microsoft, ""talvez mais pessoas se engajem em alguns desses problemas e ajudem a resolvê-los. Espero que esse documentário deixe as pessoas otimistas de que grandes problemas podem ser resolvidos"". Via: Mashable",Matheus Luque,Roseli Andrion,"Microsoft,Windows,Streaming,Bill Gates,Netflix,paul allen,Filmes&Series,código,código bill gates",2019-09-20 08:09:00,2019-09-21 18:29:43.001056,https://olhardigital.com.br/cinema-e-streaming/noticia/serie-sobre-bill-gates-estreia-hoje-na-netflix/90532
Apple gasta US$ 400 para registrar a marca 'Slofies' do iPhone 11,"O termo foi mencionado em tom de brincadeira durante a apresentação dos novos iPhones, na semana passada, mas parece que a Apple se empolgou com as ""slofies"", as selfies em câmera lenta. Na sexta-feira (13), a marca solicitou o registro comercial da palavra nos EUA — o que, potencialmente, dá à empresa o controle sobre seu uso. As selfies em câmera lenta são um recurso novo do iPhone 11. A câmera frontal dos aparelhos pode gravar vídeos a 120 quadros por segundo e isso, quando desacelerado, resulta em um efeito nítido de câmera lenta. Os resultados são bons e a Apple parece determinada a transformar a ferramenta em um fenômeno. O registro de marca das ""slofies"" especifica um ""software de computador disponível para download para uso na captura de imagens e gravação de vídeos"". Ou seja, além de garantir o uso exclusivo da palavra, a companhia parece querer impedir que os concorrentes criem aplicativos de câmera com a marca slofie. A intenção é que as slofies sejam um recurso exclusivo dos novos iPhones. Apesar do foco nos aplicativos, a empresa não oferece um ""app slofie"" ou um ""modo slofie"" nos aparelhos da marca. O recurso é chamado de ""slo-mo"" na câmera da Apple e esse nome se refere exclusivamente aos vídeos resultantes, não ao aplicativo ou ao modo de capturá-los. Se as ""slofies"" conseguirão estimular as vendas do iPhone 11, ainda não se sabe. Fato é que o recurso já é mencionado no site da Apple e a companhia precisou pagar nada menos que US$ 400 para solicitar o registro da marca. Fonte: The Verge",Henrique  Freitas,Roseli Andrion,"iPhone,Câmeras,Apple,selfie,patentes,iphone 11",2019-09-19 21:20:00,2019-09-21 18:29:43.111752,https://olhardigital.com.br/noticia/apple-gasta-us-400-para-registrar-a-marca-slofies-do-iphone-11/90527
Vaza lista de aparelhos da Samsung que receberão Android 10; confira,"O AndroidPure publicou, nesta quinta-feira (19), o que parece ser uma lista dos smartphones da Samsung que receberão o Android 10. A autenticidade do material não foi verificada, mas ele parece oficial, especialmente quando se observam os dispositivos que devem receber a atualização. Então, não crie expectativas, mas não se surpreenda se o vazamento for verídico. Confira a relação:  Há alguns aparelhos esperados, como as famílias Galaxy S10 e Galaxy Note 10. Como eles são os carros-chefe da Samsung em 2019, não poderiam ser abandonados nas atualizações. A inclusão dos tablets também faz sentido, assim como a de todos os dispositivos da linha Galaxy M, que é totalmente nova para a fabricante. O mais interessante, porém, são alguns smartphones que não estão na lista, como as famílias Galaxy S8 e Galaxy Note 8. Os aparelhos foram lançados em 2017 e já receberam três versões anteriores do Android (Nougat, Oreo e Pie). Não é razoável, portanto, que, com apenas dois anos de vida, eles não ganhem a nova versão do Android. Fonte: AndroidPure",Henrique  Freitas,Roseli Andrion,"Smartphones,Sistema Operacional,Samsung,galaxy note,Android Q,Galaxy s10,Galaxy A90,Android 10",2019-09-19 21:30:00,2019-09-21 18:29:43.264725,https://olhardigital.com.br/noticia/vaza-lista-de-aparelhos-da-samsung-que-receberao-android-10-confira/90513
Huawei vai pagar R$ 1 bilhão para desenvolvedores de aplicativos,"A série Mate 30 é o primeiro lançamento da Huawei a ser afetado pela proibição emitida no início do ano pelo Departamento de Comércio dos EUA (que proíbe empresas americanas de venderem bens ou serviços à companhia). Como resultado, o Google não tem permissão para fornecer acesso ao Google Play Services aos novos smartphones da marca. O Play Services não é apenas uma maneira de o Google pré-instalar seus aplicativos (como Gmail, Maps, Fotos e YouTube), é também o intermediário para notificações, mapas e segurança de muitos outros apps. Na China, a Huawei tem a Huawei App Gallery, com milhares de aplicativos disponíveis para download. Como substituto do Google Play Services — e para aprimorar serviços como localização, gerenciamento em nuvem, notificações e jogos —, utiliza o Huawei Mobile Services (HMS). Para tentar contornar a proibição, a empresa quer incentivar desenvolvedores dos EUA a criarem apps para a plataforma. Richard Yu, CEO da companhia, diz que o Programa de Incentivo ao Ecossistema HMS, que terá investimento de US$ 1 bilhão, busca estimular desenvolvedores a criarem aplicativos e comercializá-los em telefones da Huawei fora da China. Esses profissionais terão participação de 85% na receita dos apps — enquanto o Google e a Apple oferecem 70%. Segundo Yu, embora os serviços do Google não estejam disponíveis na Huawei App Gallery, é possível fazer o sideload nos celulares Huawei. Além disso, enquanto os desenvolvedores publicarem seus aplicativos na loja da companhia, a experiência do Android na EMUI 10 não será muito diferente do que ocorria nas versões anteriores. Em coletiva de imprensa do lançamento da série Mate 30, em Munique, na Alemanha, o CEO disse que lamenta a situação. ""No passado nós nunca fizemos isso, mas agora precisamos fazer. O governo americano nos forçou a isso e não temos outra opção."" Yu disse, ainda, que a Huawei já considera outras lojas de aplicativos — de empresas como Aptoide e F-Droid. A App Store da Amazon é provavelmente a mais familiar para os usuários do ocidente, mas é pouco provável que a companhia chinesa consiga um acordo com ela, já que é mais uma companhia dos EUA. Fonte: Android Central",Luiza Tozzato,Roseli Andrion,"Smartphones,China,Google Play,Huawei,smartphone,Google fotos,play store,google app,EUA,eua x china,huawei,Mate 30 Pro",2019-09-19 21:45:00,2019-09-21 18:29:43.284366,https://olhardigital.com.br/noticia/huawei-vai-pagar-r-1-bilhao-para-desenvolvedores-de-aplicativos/90522
Google anuncia maior compra de energias renováveis da história,"Nesta quinta-feira (19), o Google afirmou estar realizando a maior compra corporativa de energias renováveis da história. A compra inclui um pacote com contratos de 1.600 megawatts e 18 novos acordos na área de energia. Juntas, essas operações aumentam em quase 50% sua carteira global de fazendas de energia solar e eólica, atingindo mais de cinco mil megawatts - o equivalente à capacidade de um milhão de telhados solares. Quando todos esses projetos estiverem em funcionamento, a carteira zero-carbono do Google irá irá produzir mais energia elétrica do que uma cidade como Washington, D.C. ou países inteiros como Lituânia ou Uruguai consome em um ano. Os novos contratos vão exigir a construção da infraestrutura de energia com custo de US$ 2 bilhões – incluindo milhões de painéis solares e centenas de turbinas eólicas espalhadas por América do Sul, Norte e Europa. Agora, a frota de energia renovável inclui ao todo 52 projetos, que correspondem a US$ 7 bilhões em novas construções e levará à criação de milhares de empregos. Nos EUA, o Google vai comprar 720 megawatts (MW) de energia de fazendas solares na Carolina do Norte (155 MW), Carolina do Sul (75 MW) e Texas (490 MW). Isso mais do que dobra a capacidade da carteira solar global que a empresa já tinha. Já na América do Sul, houve um crescimento de mais de 125 MW de capacidade em energias renováveis à grade que alimenta o centro de dados no Chile. Além desses dois países, ainda há uma fatia considerável na capacidade de fontes renováveis que será sediada na Europa. O contrato chileno marcou a primeira vez em que o Google fez um acordo de energia híbrida, que combina fontes solares e eólicas. Com frequência, os períodos com mais vento são diferentes dos horários com maior incidência de sol, e por isso essa mistura vai permitir que o centro de dados chileno conte com eletricidade zero-carbono durante quase todo o dia.",Fabrício Filho,Liliane Nakagawa,"Google,Energia Solar,Energia,Compras,contrato,energia renovável",2019-09-19 19:09:00,2019-09-21 18:29:43.311310,https://olhardigital.com.br/noticia/google-anuncia-maior-compra-de-energias-renovaveis-da-historia/90523
