title,writtennews,autor,editor,tags,hora da publicação,hora de acesso,url
"Testamos o Positivo P70S, um telefone 'quase smart'","Os smartphones se tornaram parte tão integrante de nossas vidas, e tão rapidamente, que é difícil imaginar que ainda existe mercado para um outro tipo de telefone celular, no caso, os 'feature phones', telefones com o tradicional formato em 'barra', teclado numérico e só um ou outro recurso mais sofisticado, como Rádio FM, câmera ou MP3 Player. De baixo custo, eles atendem a uma parcela da população que não deseja nada muito mais sofisticado do que oferecem, ou que não tem recursos para comprar um smartphone. Mas em um mundo onde o acesso à informação é cada vez mais essencial, estes usuários podem acabar 'ficando para trás', perdendo o acesso a serviços, informação ou entretenimento que estão disponíveis online para grande parcela da população. Ou seja, existe mercado para um intermediário, um 'feature phone' mais conectado, com alguns dos recursos de um smarphone, mas ainda assim de baixo custo. Essa é a aposta da Positivo com seu ‘smart feature phone’ P70S, e da KaiOS Technologies com o sistema operacional no qual ele é baseado, o KaiOS. O KaiOS é um descendente do finado Firefox OS, iniciativa da Mozilla para produzir um sistema operacional para smartphones de baixo custo, sempre conectados. Totalmente baseado em tecnologias da web (como HTML, CSS e JavaScript) o Firefox OS seria uma plataforma aberta, onde qualquer um poderia desenvolver e distribuir apps sem precisar passar por uma loja central. O principal destaque do KaiOS é a capacidade de rodar em hardware muito modesto, e portanto muito barato. É uma das iniciativas para levar a internet ao 'próximo bilhão' de usuários. Em declaração ao site Android Authority David Bang, Vice-Presidente de Marketing e Desenvolvimento de Negócios da KaiOS Technologies na América do Norte, disse que é possivel ter um telefone 4G por US$ 30, ou um modelo 3G por US$ 20. Um telefone com o KaiOS não vai rodar jogos como Asphalt 9, mas vai permitir diversas funções ao usuário: se comunicar com clientes usando o WhatsApp, se manter em contato com amigos através do Facebook, se orientar usando o Google Maps, fazer pesquisas no Google ou buscar entretenimento e conhecimento no YouTube. Todo em preto, o P70S (que tem preço sugerido de R$ 279) tem um visual bastante discreto. O que mais chama a atenção é a tela, que com 2.8' é considerada grande para essa categoria de aparelhos. Ela tem imagem aceitável considerando a faixa de preço: as cores são boas, mas os ângulos de visão não. Isso não vai prejudicar o uso do sistema no dia-a-dia, já que neste tipo de aparelho as interações são muito mais breves que em um smartphone, mas pode incomodar ao assistir vídeos no YouTube, especialmente se eles tiverem cenas escuras. O teclado tem 16 teclas e um grande botão com a logo do Google Assistente, que embora não pareça, é um direcional com 4 posições e um botão 'OK' central. Você utilizará ele e as teclas de opções à esquerda e direita para interagir com o sistema, selecionar apps, confirmar escolhas, rolar uma página Web, etc. A digitação de texto é feita pelo método T9, lembram dele? Cada tecla tem um conjunto de 3 letras atribuído a ela, por exemplo, 2 é 'ABC'. Para teclar A, aperte 2 uma vez. Para B, aperte 2 duas vezes seguidas. Para C, aperte 2 três vezes seguidas. E por aí vai.  O teclado do P70S é duro. E a teclinha verde causou uma confusão... Felizmente há um teclado preditivo: você começa a digitar uma palavra e ele mostra sugestões para completar. Você não precisa selecionar cada letra individualmente, basta pressionar as teclas onde elas estão. Por exemplo, digite pare (7273) e ele já sugere completar com parece ou parede. Conheço gente que era 'fera' no T9 e conseguia digitar mensagens imensas em poucos segundos. Mas fazer isso no P70S vai ser difícil, pois o teclado é muito duro. O mesmo pode ser dito da tecla de navegação: seria melhor se ela fosse substituída por um 'mini joystick'. Além de facilitar o uso da interface, ele tornaria mais fácil a movimentação do cursor no navegador, para selecionar links e imagens. Falando em teclado, é preciso mencionar um erro da Positivo: tive dificuldade para descobrir como digitar em maiúsculas até que resolvi consultar o manual, que diz 'Para alterar o modo de digitação entre letras minúsculas, maiúsculas e números, pressione a tecla #'. Imaginem minha surpresa ao descobrir que essa tecla aparentemente não existe no teclado. Na verdade ela existe, mas está coberta com um adesivo verde e tem o ícone do WhatsApp, já que serve como acesso direto a ele. Não há nenhuma indicação desta outra função. Aliás, no próprio manual ela é diferente, com o símbolo # e um balão de conversa ao lado, o que indica que a decisão de cobrir a tecla foi algo de última hora. O P70S é um telefone Dual-SIM e tem um slot para cartões microSD, que pode (na verdade deve) ser usado para armazenar suas fotos, vídeos e músicas, já que há apenas 512 MB de memória interna, com cerca de 138 MB disponíveis para instalação de apps, que felizmente são pequenos. Mesmo considerando que o P70S não é um smartphone e levando em consideração seu preço, a câmera (com resolução VGA, ou seja, 640 x 480 pixels) é horrenda. O tempo de exposição é muito alto e qualquer tremidinha na hora do clique vai borrar a foto, mesmo em um dia ensolarado.  Foto em ambiente interno feita com o P70S. Note como o texto sob os botões não tem definição A sensibilidade à luz é baixa e a qualidade da imagem deixa muito a desejar. Tudo bem fazer fotos em baixa resolução, mas seria legal se elas não se parecessem com algo feito através de um pedaço de celofane engordurado. Pelo menos ela tem um flash, que também serve como lanterna. A bateria tem capacidade de 1.350 mAh e dura bastante. Em um dia de uso conectado ao Wi-Fi e 4G, recebendo mensagens no WhatsApp e ouvindo músicas continuamente, medi um consumo 20% de bateria em 4 horas e 15 minutos de uso. Ou seja, uma autonomia estimada em pouco mais de 21 horas de uso. Nada mal.  Foto feita sob a luz do Sol. Note o ""borrão"" no solo. O processador do P70S é um Unisoc Quad-Core de 1.3 GHz, acompanhado por 256 MB de RAM. Não que isso seja importante para os consumidores deste tipo de aparelho, mas eu sei que vocês vão perguntar. O desempenho não é dos melhores. Isso devido à pouca quantidade de memória RAM: são apenas 256 MB, o mínimo para o KaiOS. Por causa disso, várias vezes o player de música fechou enquanto eu usava o WhatsApp, e o navegador constantemente exibe a mensagem de que 'a memória do dispositivo está acabando, e o navegador pode se comportar de forma anormal'. É um aparelho para fazer uma coisa de cada vez. O KaiOS tem uma interface simples e bastante agradável. A tela inicial tem um relógio e uma 'dock' na lateral esquerda com atalhos para os cinco principais apps. Use a tecla da esquerda para abrir uma central de notificações, e a da direita para abrir a lista de contatos. Um toque no botão central da lista de navegação abre uma lista de apps, bem semelhante ao que você veria em um smartphone Android.  Tela inicial do KaiOS A seleção de software tem o básico: registro de chamadas, lista de contatos, loja de apps, mensagens, um app do Google, câmera, navegador web, galeria, relógio, player de música, Rádio FM, agenda, calculadora, player de vídeo, configurações, gerenciador de arquivos, gravador de voz, Google Assistente, Google Maps, YouTube, Facebook e WhatsApp. Os apps são simples, mas dão conta do recado. O manual explica o básico sobre como navegar pela interface, usar a loja, ajustar configurações e usar a câmera. Só achei estranho, num aparelho com tantos serviços do Google, que a Agenda não se integre com o Google Calendar. Seria uma boa para compartilhar compromissos com outros membros da família. Para complementar os apps instalados, o KaiOS tem uma loja de aplicativos própria, chamada simplesmente de 'Loja'. Os apps são divididos em nove categorias: Recomendados, Social, Jogos, Utilitários, Estilo de Vida, Entretenimento, Saúde, Esportes e Livros e Referência. Por enquanto o catálogo é tão pequeno que dá pra contar a quantidade total de apps sem muito esforço: são 125 no momento em que escrevo este artigo.  Loja de Apps. Não há imagens, descrição ou notas para os aplicativos disponíveis A categoria com mais apps é Jogos, com 83 apps, e a menos servida é Social, com apenas três (WhatsApp, Facebook e Twitter). Curiosamente, na categoria Livros e Referência há apenas três titulos: duas versões do Corão e uma da Bíblia. Apesar da pouca quantidade, encontrei boa parte do que procurava: um agregador de notícias (KaiNews), previsão do tempo (KaiWeather), lista de tarefas (Todo), leitor de QR Code, um monitor de atividade física (Atividade) e até alguns jogos simples, como 2048, Stack Building e uma versão de Bejeweled chamada 'Gems'. De tédio eu não morro. Os apps são bem pequenos, e instalam em questão de segundos. O que não gostei foi que a loja é extremamente básica. Os apps parecem estar organizados aleatoriamente, e não há busca. Também não há screenshots dos apps, nem mesmo avaliação por parte dos outros usuários. Ou seja, o único jeito de saber se um app cumpre o que promete é instalando pra experimentar. O navegador do P70S dá conta de carregar a versão mobile dos sites, consegui até mesmo acessar a versão mobile do Instagram (m.instagram.com) e postar uma imagem a partir de lá. Mas se atrapalha com sites pesados, com muitas imagens, anúncios e scripts. A mensagem de pouca memória é constante, e não é raro o cursor demorar a responder a um comando, não responder ou o navegador simplesmente fechar na sua cara.  Mensagens de falta de memória, como acima, infelizmente são comuns Vale destacar a presença do Google Assistente. Basta segurar o botão central por alguns segundos e ele surge na tela. Aí é só fazer uma pergunta e aguardar a resposta, que pode ser falada ou então uma página web com o resultado. Você pode perguntar coisas como 'Quando o homem pousou na lua', 'Qual a previsão do tempo' ou 'Quem ganhou o último jogo do Palmeiras?'. Dá para fazer ligações dizendo 'ligar para' e o nome do contato, mas não há como definir um alarme ou timer dizendo 'alarme para 8 da noite' ou 'timer em 5 minutos', como no Assistente no Android. Mas vamos falar do principal atrativo do P70S, o WhatsApp. A experiência básica está ali: você pode conversar com contatos e grupos, compartilhar fotos, músicas e vídeos, enviar e receber mensagens de áudio, compartilhar sua localização e encaminhar mensagens. Mas também há limitações: nada de chamadas de áudio ou vídeo, compartilhamento de documentos, citações (respostas com a mensagem original acima), emojis, GIFs e WhatsApp Web. Também não há suporte a 'stickers' customizados: o app avisa que o aparelho não é compatível.  WhatsApp: Dá pra bater papo, se você aguentar o teclado Uma vez configurado, o app roda em segundo plano, como no Android. Se uma mensagem chegar, uma notificação no topo da tela mostra o remetente e um trecho dela. As notificações se integram à central de notificações do sistema, e abrir uma delas abre o app diretamente na mensagem correspondente. Infelizmente, o duro teclado numérico prejudica bastante o uso do WhatsApp. Digitar uma mensagem longa requer paciência (até você se adaptar ao layout) e força. Dá pra mandar mensagens de voz, mas muitos contatos e grupos não gostam de recebê-las. Em um mundo tão acostumado a smartphones, existe espaço para o P70S? Eu diria que sim, mas ele não é lá muito grande. Vejo o aparelho como uma opção para um parente mais idoso, que se confunde com os smartphones e prefere algo mais simples. Também para quem não tem familiaridade com a tecnologia. Ou como um 'celular de backup' caso seu aparelho principal seja danificado ou roubado. Talvez até como 'celular de balada', pra você levar em um show sem preocupação e ainda se manter em contato com seus amigos. Fora esses casos, há poucos motivos para recomendar o P70S. Ainda mais considerando que pelo preço (R$ 280, segundo a fabricante) você encontra smartphones Android com telas e câmeras melhores, onde é muito mais fácil digitar. Em uma busca rápida encontrei o Twist 2 Fit, da própria Positivo, por R$ 280. Outras fabricantes, como a Multilaser, Semp e Alcatel, também tem aparelhos nessa faixa de preço. Não importa qual você escolher, todos vão ter tela maior, câmeras melhores e mais espaço interno que o P70S. Ainda assim, a ideia por trás do sistema operacional KaiOS é interessante. Gostaria de ver do que ele é capaz em hardware um pouco melhor.",Rafael Rigues,Matheus Luque,"Positivo,review,firefox os,feature phones,Celular,kaios",2019-09-19 16:09:00,2019-09-21 18:29:44.291527,https://olhardigital.com.br/noticia/testamos-o-positivo-p70s-um-telefone-quase-smart/90508
Como instalar o iOS 13 no iPhone,"Além da espera pelo iPhone 11, muitos fãs da Apple aguardam ansiosamente por atualizações do iOS, que hoje, dia 19 de setembro, chega a sua décima terceira versão. Como de costume, é claro, a nova versão do sistema da Apple traz muitas novidades e recursos interessantes. Para instalar o iOS 13, entretanto, é necessário ter um iPhone, que seja disponível com a sua última atualização, sendo que ela pode ser realizada diretamente no celular. A seguir, veja como atualizar o iPhone para o iOS 13. Antes de prosseguir com o tutorial para instalar o iOS 13 é necessário saber quais aparelhos são compatíveis com ele. Por isto, o Olhar Digital elaborou uma lista completa destes dispositivos. Confira: Além deles, o iPod touch da sétima geração também é compatível com o iOS 13, sem contar a linha do iPhone 11, onde o iOS 13 já é o seu sistema padrão. Antes de realizar a instalação do iOS 13 em seu aparelho, é recomendado que você faça um backup dele, que pode ser feito com a ajuda do programa iTunes. Para isso, com o aparelho conectado ao computador, basta abrir o iTunes, selecionar o ícone do dispositivo conectado e usar a opção de backup. A forma mais fácil de atualizar o sistema do iPhone para o iOS 13 acaba sendo realiza-la diretamente no aparelho. Para realizá-la, basta seguir estes passos: Pronto! Agora, você já sabe como fazer a instalação do iOS 13 em seu iPhone para aproveitar todos os seus novos recursos.",Alvaro Scola,,"iPhone,Dicas,iOS,Dicas&Tutoriais,iOS 13",2019-09-19 16:09:00,2019-09-21 18:29:44.328680,https://olhardigital.com.br/dicas_e_tutoriais/noticia/como-instalar-o-ios-13-no-iphone/90507
Evolução do Farfetch'd é anunciada para Pokemon Sword,"Após fãs do anime ficarem eufóricos com a conquista de Ash em uma liga Pokemon, este ano, surge mais uma novidade que promete mantê-los entusiasmados. O pato origianal da série, Farfetch'd, vai ganhar uma evolução no jogo Pokémon Sword. O Sirfetch'd será do tipo lutador e vai utilizar uma lança e um escudo como acessórios de batalha! A Nintendo havia feito teasers sobre Sirfetch'd, mostrando apenas um sprite borrado e algumas informações sobre a criatura. O mistério levou alguns fãs a acreditarem que era uma versão Galariana de Cubone ou até um Pokémon inédito. Pokémon Sword e Shield vão ser lançados dia 15 de novembro para Nintendo Switch. Confira abaixo o vídeo do anúncio do Sirfetch'd:  Via: The Verge",Fabrício Filho,Matheus Luque,"Games,Filmes,Nintendo,jogos,Nintendo Switch,Pokémon,Nintendo Switch Lite",2019-09-19 16:09:00,2019-09-21 18:29:44.357942,https://olhardigital.com.br/games-e-consoles/noticia/evolucao-do-farfetch-d-e-anunciada-para-pokemon-sword/90509
Estreias da semana no cinema 19/09/2019 a 26/09/2019,"É uma semana interessante nos cinemas. A começar pelo novo filme de Ari Aster. Com título brasileiro meio ridículo, O Mal Não Espera a Noite – Midsommar, em que o nome original surge depois de sua tradução livre, contrariamente ao que sempre acontece, trata-se de um longa tido como superior ao anterior do mesmo diretor, Hereditário. Sabemos que raramente se perde dinheiro com filme de horror. Quando é vagabundo, provavelmente veio barato, dentro de um pacote que tinha filmes melhores (ou um grande filme que compensa a compra do pacote). A força do gênero é o que torna esse longa uma das estreias mais esperadas dos últimos meses. Mas há também o quinto filme com o personagem Rambo, imortalizado por Sylvester Stallone nos anos 1980. Dirigido por Adrian Grunberg e já considerado bastante violento (apesar da indicação para maiores de 12 anos), Rambo – Até o Fim, tem uma promessa no título. Mas as promessas só foram vingadas no primeiro Rambo, o único que vale a pena ser revisto. Ainda assim, Stallone não precisa provar nada para ninguém, e seu nome é ainda um atrativo. Vale destacar ainda o surpreendente filme brasileiro Os Jovens Baumann, de Bruna Carvalho de Almeida. Trata-se de uma ficção rodada como um filme de ""found footage"", ou seja, imagens encontradas, para narrar a história do desaparecimento de oito primos durante uma viagem de verão à fazenda da família, no sul de Minas Gerais. A maneira como a diretora opera as imagens de VHS, com aquela textura especial e a falta de definição traduzida em charme, faz valer este filme que só não é melhor porque a narração entrega muito para o espectador.  Vale conferir o uruguaio Meu Mundial – Para Vencer Não Basta Jogar, de Carlos Andrés Morelli, sobre uma promessa do futebol que tem a carreira abortada muito cedo. Típico filme de autoajuda, pela sinopse. Mas o cinema uruguaio tem nos reservado algumas surpresas nos últimos anos. Pode ser uma boa companhia para o documentário brasileiro Uruguai na Vanguarda, de Marco Antonio Pereira, sobre o avanço social do país vizinho nos últimos anos, enquanto o Brasil insiste em andar para trás.  Por falar em atraso e Brasil, o importante Torre das Donzelas, de Susanna Lira, fala de tortura durante a ditadura militar, com relatos de Dilma Rousseff e de suas companheiras de cela. Um hino pela resistência, contra a barbárie da tortura. E depois de Yesterday, outro filme inglês tem a música de um astro do rock como centro. Desta vez é Bruce Springsteen, músico americano que serve de inspiração para um adolescente na difícil Inglaterra de 1987. O título brasileiro é pouco imaginativo: A Música da Minha Vida. Melhor atentar para o original, que remete a um dos maiores sucessos de Springsteen: Blinded By the Light. O resultado, porém, é tão desanimador quanto Yesterday. Há ainda o francês Branca como a Neve, de Anne Fontaine, diretora que cresceu bastante nos últimos anos, com a sempre carismática Isabelle Huppert. Ou o italiano Dafne, de Frederico Bondi, que chega com elogios de parte da crítica internacional. Ou ainda o americano Depois do Casamento, de Bart Freundlich, que é credenciado por um elenco que reúne Michelle Williams e Julianne Moore. Completam a enorme lista de estreias a animação francesa Asterix e o Segredo da Poção Mágica, de Louis Clichy e Alexandre Astier; o documentário americano Longe da Árvore, de Rachel Dretzin; e o drama espanhol O Maior Presente, de Juan Manuel Cotelo.",Sergio  Alpendre,Wharrysson Lacerda,"Filmes,Cinema,Filmes&Series",2019-09-19 15:09:00,2019-09-21 18:29:44.383173,https://olhardigital.com.br/cinema-e-streaming/noticia/estreias-da-semana-no-cinema-19-09-2019-a-26-09-2019/90558
Estudo que apontava 'chifre' causado por uso de celular estava incorreto,"Há alguns meses, o mundo foi surpreendido com um estudo científico que apontava uma ligação entre o uso excessivo do celular e a formação de um tipo de calo ósseo na nuca de jovens, análogo a um chifre, que seria causado pela má postura ao usar o dispositivo. Agora, os cientistas decidiram publicar uma série de correções para afirmar que, não, usar o celular não causa chifres. O artigo no qual o efeito havia sido amplamente criticado na época pela comunidade científica, forçando sua republicação com vários ajustes, o que é um movimento levemente constrangedor tanto para seus autores quanto para a Scientific Reports, a revista onde o artigo havia divulgado. Com o ajuste, o resumo do estudo foi bastante alterado, assim como a descrição da metodologia, dos resultados e de outras partes cruciais do artigo que levaram à conclusão precipitada, como aponta o site Engadget. O artigo foi reformulado para eliminar qualquer menção a tablets e smartphones como potenciais culpados pela formação óssea incomum encontrada em alguns pacientes. Além disso, a linguagem do texto foi repensada para destacar a natureza especulativa das informações. A frase mais polêmica do estudo foi totalmente removida. A sentença “Nós hipotetizamos que a EEOP [protuberância ampliada occipital externa] esteja ligada às posturas aberrantes associadas com a emergência e uso extensivo de tecnologias móveis contemporâneas, como smartphones e tablets”, não pode mais ser encontrada na versão corrigida do artigo. Os autores também clarificam alguns pontos de que não evidências que ligam o “chifre” ao uso de celulares e deixa claro que os dados foram obtidos de um banco de dados clínicos e não de um grupo de estudos. Além disso, e talvez mais importante, também foi deixado claro no novo artigo um conflito de interesse que não havia sido revelado previamente: um dos autores do estudo vende serviços voltados para tratamento de problemas de postura.",Renato  Santino,,Ciência,2019-09-19 15:30:00,2019-09-21 18:29:44.446650,https://olhardigital.com.br/noticia/estudo-que-apontava-chifre-causado-por-uso-de-celular-estava-incorreto/90504
Nova listagem FCC indica que Pixelbook 2 será lançado em breve,"O Google deve lançar seu Chromebook Pixelbook 2 em breve, pelo menos é o que indica a nova listagem da FCC. Essa não é a primeira vez que o notebook aparece na listagem da FCC. Em 2018, o documento já evidenciava que o Google estava trabalhando em um tipo de Chromebook, com codinome “Atlas”. Além disso, a listagem atual conta com uma “alteração de ID” do chip Wi-Fi e Bluetooth da Intel de “PD99260D2L” para “HFSG021A” – o código G021A reforça o indício de que se trata do Pixelbook 2.   A documentação também especifica que o dispositivo é um “laptop” e as imagens revelam mais detalhes a respeito do aparelho: a principal diferença é a localização das antenas Wi-Fi e Bluetooth, próximas a dobradiça traseira que divide a tela e o teclado.  A listagem também confirma que o dispositivo utilizará o protocolo Wi-Fi 802.11ac, e não o protocolo mais recente 802.11ax. Por fim, inclui suporte dual-band para 2.4GHz e 5GHz. Ainda não há indicação de qual versão do Bluetooth está presente. O que se sabe até agora sobre o Pixelbook 2 Alguns detalhes sobre o dispositivo sob o codinome “Atlas” circulam na mídia internacional. Há especulações de que um modelo LTE pode estar em andamento, mas não há nada na listagem FCC para apoiar essa informação. Pistas também indicam que o Pixelbook 2 do Google será lançado com um painel de resolução 4K. Nas especificações internas, o próximo lançamento apresenta ligeira melhorias em relação ao Google Pixel Slate. Espera-se as versões Intel Core i7 e Intel Core i5, também é provável que ambos sejam fornecidos com 16GB de RAM. Além disso, está previsto o carregamento de 60W, superando os 45W usados anteriormente. Fonte: Android Headlines",Luiza Tozzato,Matheus Luque,"Notebooks,Laptops,Google,Chromebook,chromebooks,google pixel",2019-09-19 15:09:00,2019-09-21 18:29:44.630773,https://olhardigital.com.br/noticia/nova-listagem-fcc-indica-que-pixelbook-2-sera-lancado-em-breve/90506
